{
  "id": "cortisol-20260629",
  "title": "壓力正壓垮你的臉：從皮質醇到下垂臉的真相",
  "slug": "cortisol",
  "date": "2026-06-29",
  "series": "chickendad-notes",
  "seriesTitle": "ChickenDad 札記",
  "characters": [
    "ChickenDad"
  ],
  "category": "健康生活",
  "tags": [
    "皮質醇",
    "健康",
    "壓力",
    "臉部老化"
  ],
  "readingTime": 7,
  "summary": "皮質醇不是壞人，但長期壓力會讓臉部與身體失去修復節奏。",
  "cover": "/images/cover-health.svg",
  "url": "/articles/cortisol.html",
  "featured": false,
  "hero": false,
  "quote": "健康不是追求完美，而是學會理解身體的訊號。"
}