{
  "id": "dragons-champion-20260629",
  "title": "味全龍這一冠，屬於用心經營的球團！",
  "slug": "dragons-champion",
  "date": "2026-06-29",
  "series": "baseball-notes",
  "seriesTitle": "棒球觀察",
  "characters": [
    "ChickenDad"
  ],
  "category": "棒球故事",
  "tags": [
    "味全龍",
    "棒球",
    "CPBL",
    "養成"
  ],
  "readingTime": 6,
  "summary": "從情蒐、養成、跑壘到投手整合，重新理解上半季冠軍。",
  "cover": "/images/cover-baseball.svg",
  "url": "/articles/dragons-champion.html",
  "featured": false,
  "hero": false,
  "quote": "一支球隊的強大，往往藏在看不見的系統裡。"
}